{"artifact_media_types":["application/vnd.dci.benchmark+json"],"default_case_limit":125,"default_concurrency":1,"owner_package":{"package_id":"dci","version":"1.0.0"},"protocol":"asterion.benchmark-suite/v1","suite_id":"dci.paper-main","tasks":[{"binding_id":"bcplus.main","capability":{"capability_id":"dci.benchmark","version":"1.0.0"},"metric_contract_id":"dci.benchmark-metric/v1","note":"Paper-main benchmark task.","result_contract_id":"dci.benchmark-result/v1","task_id":"bcplus.main"},{"binding_id":"beir.arguana","capability":{"capability_id":"dci.benchmark","version":"1.0.0"},"metric_contract_id":"dci.benchmark-metric/v1","note":"Paper-main benchmark task.","result_contract_id":"dci.benchmark-result/v1","task_id":"beir.arguana"},{"binding_id":"beir.scifact","capability":{"capability_id":"dci.benchmark","version":"1.0.0"},"metric_contract_id":"dci.benchmark-metric/v1","note":"Paper-main benchmark task.","result_contract_id":"dci.benchmark-result/v1","task_id":"beir.scifact"},{"binding_id":"bright.biology","capability":{"capability_id":"dci.benchmark","version":"1.0.0"},"metric_contract_id":"dci.benchmark-metric/v1","note":"Paper-main benchmark task.","result_contract_id":"dci.benchmark-result/v1","task_id":"bright.biology"},{"binding_id":"bright.earth-science","capability":{"capability_id":"dci.benchmark","version":"1.0.0"},"metric_contract_id":"dci.benchmark-metric/v1","note":"Paper-main benchmark task.","result_contract_id":"dci.benchmark-result/v1","task_id":"bright.earth-science"},{"binding_id":"bright.economics","capability":{"capability_id":"dci.benchmark","version":"1.0.0"},"metric_contract_id":"dci.benchmark-metric/v1","note":"Paper-main benchmark task.","result_contract_id":"dci.benchmark-result/v1","task_id":"bright.economics"},{"binding_id":"bright.robotics","capability":{"capability_id":"dci.benchmark","version":"1.0.0"},"metric_contract_id":"dci.benchmark-metric/v1","note":"Paper-main benchmark task.","result_contract_id":"dci.benchmark-result/v1","task_id":"bright.robotics"},{"binding_id":"qa.2wikimultihopqa","capability":{"capability_id":"dci.benchmark","version":"1.0.0"},"metric_contract_id":"dci.benchmark-metric/v1","note":"Paper-main benchmark task.","result_contract_id":"dci.benchmark-result/v1","task_id":"qa.2wikimultihopqa"},{"binding_id":"qa.bamboogle.paper-full125","capability":{"capability_id":"dci.benchmark","version":"1.0.0"},"metric_contract_id":"dci.benchmark-metric/v1","note":"Paper-main 125-case Bamboogle task.","result_contract_id":"dci.benchmark-result/v1","task_id":"qa.bamboogle.paper-full125"},{"binding_id":"qa.hotpotqa","capability":{"capability_id":"dci.benchmark","version":"1.0.0"},"metric_contract_id":"dci.benchmark-metric/v1","note":"Paper-main benchmark task.","result_contract_id":"dci.benchmark-result/v1","task_id":"qa.hotpotqa"},{"binding_id":"qa.musique","capability":{"capability_id":"dci.benchmark","version":"1.0.0"},"metric_contract_id":"dci.benchmark-metric/v1","note":"Paper-main benchmark task.","result_contract_id":"dci.benchmark-result/v1","task_id":"qa.musique"},{"binding_id":"qa.nq","capability":{"capability_id":"dci.benchmark","version":"1.0.0"},"metric_contract_id":"dci.benchmark-metric/v1","note":"Paper-main benchmark task.","result_contract_id":"dci.benchmark-result/v1","task_id":"qa.nq"},{"binding_id":"qa.triviaqa","capability":{"capability_id":"dci.benchmark","version":"1.0.0"},"metric_contract_id":"dci.benchmark-metric/v1","note":"Paper-main benchmark task.","result_contract_id":"dci.benchmark-result/v1","task_id":"qa.triviaqa"}],"version":"1.0.0"}
