{"artifact_media_types":["application/vnd.dci.benchmark+json"],"default_case_limit":50,"default_concurrency":1,"owner_package":{"package_id":"dci","version":"1.0.0"},"protocol":"asterion.benchmark-suite/v1","suite_id":"dci.github","tasks":[{"binding_id":"bcplus.level3","capability":{"capability_id":"dci.benchmark","version":"1.0.0"},"metric_contract_id":"dci.benchmark-metric/v1","note":"GitHub benchmark task.","result_contract_id":"dci.benchmark-result/v1","task_id":"bcplus.level3"},{"binding_id":"bcplus.main","capability":{"capability_id":"dci.benchmark","version":"1.0.0"},"metric_contract_id":"dci.benchmark-metric/v1","note":"GitHub benchmark task.","result_contract_id":"dci.benchmark-result/v1","task_id":"bcplus.main"},{"binding_id":"bright.biology","capability":{"capability_id":"dci.benchmark","version":"1.0.0"},"metric_contract_id":"dci.benchmark-metric/v1","note":"GitHub benchmark task.","result_contract_id":"dci.benchmark-result/v1","task_id":"bright.biology"},{"binding_id":"bright.earth-science","capability":{"capability_id":"dci.benchmark","version":"1.0.0"},"metric_contract_id":"dci.benchmark-metric/v1","note":"GitHub benchmark task.","result_contract_id":"dci.benchmark-result/v1","task_id":"bright.earth-science"},{"binding_id":"bright.economics","capability":{"capability_id":"dci.benchmark","version":"1.0.0"},"metric_contract_id":"dci.benchmark-metric/v1","note":"GitHub benchmark task.","result_contract_id":"dci.benchmark-result/v1","task_id":"bright.economics"},{"binding_id":"bright.robotics","capability":{"capability_id":"dci.benchmark","version":"1.0.0"},"metric_contract_id":"dci.benchmark-metric/v1","note":"GitHub benchmark task.","result_contract_id":"dci.benchmark-result/v1","task_id":"bright.robotics"},{"binding_id":"qa.2wikimultihopqa","capability":{"capability_id":"dci.benchmark","version":"1.0.0"},"metric_contract_id":"dci.benchmark-metric/v1","note":"GitHub benchmark task.","result_contract_id":"dci.benchmark-result/v1","task_id":"qa.2wikimultihopqa"},{"binding_id":"qa.bamboogle.github-sample50","capability":{"capability_id":"dci.benchmark","version":"1.0.0"},"metric_contract_id":"dci.benchmark-metric/v1","note":"GitHub 50-case Bamboogle task.","result_contract_id":"dci.benchmark-result/v1","task_id":"qa.bamboogle.github-sample50"},{"binding_id":"qa.hotpotqa","capability":{"capability_id":"dci.benchmark","version":"1.0.0"},"metric_contract_id":"dci.benchmark-metric/v1","note":"GitHub benchmark task.","result_contract_id":"dci.benchmark-result/v1","task_id":"qa.hotpotqa"},{"binding_id":"qa.musique","capability":{"capability_id":"dci.benchmark","version":"1.0.0"},"metric_contract_id":"dci.benchmark-metric/v1","note":"GitHub benchmark task.","result_contract_id":"dci.benchmark-result/v1","task_id":"qa.musique"},{"binding_id":"qa.nq","capability":{"capability_id":"dci.benchmark","version":"1.0.0"},"metric_contract_id":"dci.benchmark-metric/v1","note":"GitHub benchmark task.","result_contract_id":"dci.benchmark-result/v1","task_id":"qa.nq"},{"binding_id":"qa.triviaqa","capability":{"capability_id":"dci.benchmark","version":"1.0.0"},"metric_contract_id":"dci.benchmark-metric/v1","note":"GitHub benchmark task.","result_contract_id":"dci.benchmark-result/v1","task_id":"qa.triviaqa"}],"version":"1.0.0"}
