{"artifact_media_types":["application/vnd.dci.benchmark+json"],"default_case_limit":125,"default_concurrency":1,"owner_package":{"package_id":"dci","version":"1.0.0"},"protocol":"asterion.benchmark-suite/v1","suite_id":"dci.qa.bamboogle.paper-full125","tasks":[{"binding_id":"qa.bamboogle.paper-full125","capability":{"capability_id":"dci.benchmark","version":"1.0.0"},"metric_contract_id":"dci.answer-correctness/v1","note":"Paper main full 125-case contract.","result_contract_id":"dci.benchmark-result/v1","task_id":"qa.bamboogle.paper-full125"}],"version":"1.0.0"}
