{"artifact_media_types":["application/json"],"default_case_limit":1,"default_concurrency":1,"owner_package":{"package_id":"controlled-code","version":"1.0.0"},"protocol":"asterion.benchmark-suite/v1","suite_id":"controlled-code.conformance","tasks":[{"binding_id":"controlled-code.conformance","capability":{"capability_id":"workflow.code-quality","version":"1.0.0"},"metric_contract_id":"controlled-code.metric/v1","note":"","result_contract_id":"controlled-code.result/v1","task_id":"controlled-code.conformance"}],"version":"1.0.0"}
