{"artifact_media_types":["application/vnd.dci.benchmark+json"],"default_case_limit":830,"default_concurrency":1,"owner_package":{"package_id":"dci","version":"1.0.0"},"protocol":"asterion.benchmark-suite/v1","suite_id":"dci.bcplus.level3","tasks":[{"binding_id":"bcplus.level3","capability":{"capability_id":"dci.benchmark","version":"1.0.0"},"metric_contract_id":"dci.answer-correctness/v1","note":"BrowseComp-Plus level3 830-case contract.","result_contract_id":"dci.benchmark-result/v1","task_id":"bcplus.level3"}],"version":"1.0.0"}
