{"artifact_media_types":["application/json"],"default_case_limit":1,"default_concurrency":1,"owner_package":{"package_id":"acme.sample","version":"1.0.0"},"protocol":"asterion.benchmark-suite/v1","suite_id":"acme.suite","tasks":[{"binding_id":"acme.task","capability":{"capability_id":"acme.research","version":"1.0.0"},"metric_contract_id":"acme.metric/v1","note":"","result_contract_id":"acme.result/v1","task_id":"acme.task"}],"version":"1.0.0"}
