{"artifact_media_types":["application/vnd.dci.benchmark+json"],"default_case_limit":12576,"default_concurrency":1,"owner_package":{"package_id":"dci","version":"1.0.0"},"protocol":"asterion.benchmark-suite/v1","suite_id":"dci.qa.2wikimultihopqa","tasks":[{"binding_id":"qa.2wikimultihopqa","capability":{"capability_id":"dci.benchmark","version":"1.0.0"},"metric_contract_id":"dci.answer-correctness/v1","note":"2WikiMultiHopQA 12,576-question answer-correctness contract.","result_contract_id":"dci.benchmark-result/v1","task_id":"qa.2wikimultihopqa"}],"version":"1.0.0"}
