{"artifact_media_types":["application/vnd.dci.benchmark+json"],"default_case_limit":103,"default_concurrency":1,"owner_package":{"package_id":"dci","version":"1.0.0"},"protocol":"asterion.benchmark-suite/v1","suite_id":"dci.bright.economics","tasks":[{"binding_id":"bright.economics","capability":{"capability_id":"dci.benchmark","version":"1.0.0"},"metric_contract_id":"dci.ndcg-at-10/v1","note":"Bright Economics 103-query binary deduplicated nDCG@10 contract.","result_contract_id":"dci.benchmark-result/v1","task_id":"bright.economics"}],"version":"1.0.0"}
