{"artifact_media_types":["application/vnd.dci.benchmark+json"],"default_case_limit":2417,"default_concurrency":1,"owner_package":{"package_id":"dci","version":"1.0.0"},"protocol":"asterion.benchmark-suite/v1","suite_id":"dci.qa.musique","tasks":[{"binding_id":"qa.musique","capability":{"capability_id":"dci.benchmark","version":"1.0.0"},"metric_contract_id":"dci.answer-correctness/v1","note":"Musique 2,417-question answer-correctness contract.","result_contract_id":"dci.benchmark-result/v1","task_id":"qa.musique"}],"version":"1.0.0"}
