{"artifact_media_types":["application/vnd.dci.benchmark+json"],"default_case_limit":1406,"default_concurrency":1,"owner_package":{"package_id":"dci","version":"1.0.0"},"protocol":"asterion.benchmark-suite/v1","suite_id":"dci.beir.arguana","tasks":[{"binding_id":"beir.arguana","capability":{"capability_id":"dci.benchmark","version":"1.0.0"},"metric_contract_id":"dci.ndcg-at-10/v1","note":"BEIR ArguAna 1406-query binary deduplicated nDCG@10 contract.","result_contract_id":"dci.benchmark-result/v1","task_id":"beir.arguana"}],"version":"1.0.0"}
