{"artifact_media_types":["application/json"],"default_case_limit":1,"default_concurrency":1,"owner_package":{"package_id":"example.package","version":"1.0.0"},"protocol":"asterion.benchmark-suite/v1","suite_id":"example.suite","tasks":[{"binding_id":"example.task","capability":{"capability_id":"example.research","version":"1.0.0"},"metric_contract_id":"example.metric/v1","note":"","result_contract_id":"example.result/v1","task_id":"example.task"}],"version":"1.0.0"}
